date,content,female,male
2024/4/10,"Unified Socialist supports UML candidate for National Assembly Vice Chairman KATHHMANDU, April 10: CPN (Unified Socialist) Party has announced its support to CPN-UML's candidate Bimala Ghimire for the post of Vice-Chairman of the National Assembly. KATHHMANDU, April 10: CPN (Unified Socialist) Party has announced its support to CPN-UML's candidate Bimala Ghimire for the post of Vice-Chairman of the National Assembly. Nepali Congress's Bishnu Devi Pudasaini is also contesting for the position of National Assembly Vice Chairman. Earlier, the CPN (Unified Socialist) also claimed the position of vice-chairman. But after the nomination of the UML, the CPN (Unified Socialist) decided not to field a separate candidate. According to Jagannath Khatiwada, Deputy General Secretary and Spokesperson of CPN (Unified Socialist) Party, they have decided to vote for UML's candidate Ghimire. The election for the post of vice chairman is scheduled for today.",1,0
2024/4/10,"Election for Vice Chair of National Assembly being held today KATHMANDU, April 10: The election for the post of National Assembly Vice Chairman is being held today. The agenda for today's meeting of the National Assembly includes the election. The meeting is scheduled to commence at 1:15 PM. KATHMANDU, April 10: The election for the post of National Assembly Vice Chairman is being held today. The agenda for today's meeting of the National Assembly includes the election. The meeting is scheduled to commence at 1:15 PM. Bimala Ghimire from CPN-UML and Bishnu Devi Pudasaini from the opposition party Nepali Congress are the candidates for the post of National Assembly Vice Chairman. During today's National Assembly session, member Durga Gurung will propose the election of Nepali Congress' Pudasaini, while Bhagwati Neupane will propose the election of UML's Ghimire. Speaker Narayan Dahal will propose in today's meeting that the proposers of both candidates take turns presenting their proposals. According to the Federal Parliament Secretariat, the proposal that garners majority support will be elected. Furthermore, in today's meeting, the Secretary of the National Assembly, Dr Surendra Aryal, will provide information about the 'Food Hygiene and Quality Bill, 2077 BS', which was passed by the National Assembly and forwarded to the House of Representatives with a message.",1,0
2024/4/12,"Federal Parliament session set to end on April 14 KATHMANDU, April 12: The current session of the Federal Parliament is set to end on April 14. A meeting of the Council of Ministers held on Friday decided to recommend to President Ram Chandra Paudel to end the current session of parliament from midnight on April 14. The winter session of parliament started on February 5. Meanwhile, the Federal Parliament has passed three bills in this session so far. Similarly, the government has recommended to the president to nominate Anjan Shakya, former Nepali ambassador to Israel, for the vacant position of the National Assembly. The government has also decided to set up a recommendation committee to recommend the appointment of the chairman and members of both commissions under Section 3 of the Commission for Investigation, Verification, and Reconciliation of Disappeared Persons Act, 2071. It has been decided to appoint Om Prakash Mishra, the former Chief Justice of the Supreme Court, as the chairman of the Commission of Investigation on Enforced Disappeared Persons. Similarly, the government has decided to recognize orange as the national fruit.",1,0
2024/4/18,"Dr Anjan Shakya nominated as National Assembly member KATHMANDU, April 18: President Ram Chandra Paudel has nominated Dr Anjan Shakya as a member of the National Assembly, based on the government's recommendation. KATHMANDU, April 18: President Ram Chandra Paudel has nominated Dr Anjan Shakya as a member of the National Assembly, based on the government's recommendation. President Paudel has nominated Shakya as a member of the National Assembly in accordance with Clause (2) of Article 86 of the Constitution of Nepal, according to a statement issued by the President's Office today. The Council of Ministers meeting on March 30th recommended to President Paudel to nominate Dr Shakya as a member of the National Assembly. Article 86 of the Constitution of Nepal, Clause 2 (b) provides for nominating three people, including at least one woman, in the National Assembly on the recommendation of the government.",1,0
2024/4/21,"National Assembly Chair Ghimire resigns from party responsibilities KATHMANDU, April 21: Bimala Ghimire, Vice Chair of the National Assembly, has announced her resignation from all party responsibilities. Ghimire, who has served as a member for the past four years, was elected to the position of vice chairman on April 10. KATHMANDU, April 21: Bimala Ghimire, Vice Chair of the National Assembly, has announced her resignation from all party responsibilities. Ghimire, who has served as a member for the past four years, was elected to the position of vice chairman on April 10. ""After assuming the role of vice chair of the National Assembly, I hereby announce my decision to relinquish all party responsibilities. This step is taken in accordance with parliamentary dignity and tradition,” she said, “I am committed to fulfilling my duties with fairness and transparency, I convey this decision to the public through mass media.”",1,0
2024/4/3,"National Assembly Vice-Chairman election set for April 10 KATHMANDU, April 3: The National Assembly is gearing up to hold elections to fill the vacant position of Vice-Chairman on April 10, as announced today by National Assembly Chairman Narayan Dahal. KATHMANDU, April 3: The National Assembly is gearing up to hold elections to fill the vacant position of Vice-Chairman on April 10, as announced today by National Assembly Chairman Narayan Dahal. The post fell vacant after Urmila Aryal resigned on May 28, as per an agreement within the ruling alliance. However, the alliance is still deliberating on the allocation of the vacant seat.",1,0
2024/4/9,"Bishnu and Bimala register candidacy for National Assembly vice-chairperson KATHMANDU, April 9: Candidates of Nepali Congress (NC) and CPN-UML have registered their nominations for the post of National Assembly vice-chairperson. KATHMANDU, April 9: Candidates of Nepali Congress (NC) and CPN-UML have registered their nominations for the post of National Assembly vice-chairperson. Bishnu Devi Pudasaini of NC and Bimala Ghimire of CPN-UML have registered their candidatures. The election will be held on Wednesday. After registering their candidacies, both candidates said that they will play a role in making the dignity of the National Assembly even higher. Ghimire, who is ahead in terms of numbers in the National Assembly, said that if she is elected, she will consult with the Chairperson of the National Assembly and play an effective role in advancing the bills. Similarly, NC candidate Pudasaini said that she is confident that she will win the election because everyone loves her.",1,0
2024/4/9,"NC nominates Bishnudevi Pudasaini as candidate for vice-chairperson of National Assembly KATHMANDU, April 9: The Nepali Congress (NC) has nominated Bishnudevi Pudasaini as the party’s candidate for the post of vice chairperson of the National Assembly. KATHMANDU, April 9: The Nepali Congress (NC) has nominated Bishnudevi Pudasaini as the party’s candidate for the post of vice chairperson of the National Assembly. The NC parliamentary party working committee meeting held this morning decided to nominate Pudasaini from Kathmandu as a candidate. Meanwhile, UML’s Bimala Ghimire, representing Kapilvastu, has been nominated as the candidate of the ruling coalition. There is an agenda for the registration of nominations for the position of vice-chairperson of the National Assembly today.",1,0
2024/7/7,"National Assembly endorses bill on amending some Nepal's acts for promoting investment KATHMANDU, July 7: The National Assembly has unanimously endorsed the Bill to Amend Some Nepal Acts, aiming to enable an atmosphere conducive for investment. KATHMANDU, July 7: The National Assembly has unanimously endorsed the Bill to Amend Some Nepal Acts, aiming to enable an atmosphere conducive for investment. A session of the upper house on Sunday passed the Bill along with the message from the House of Representatives regarding the Bill. Minister for Communications and Information Technology, Rekha Sharma, presented the Bill before the session on behalf of Prime Minister Pushpa Kamal Dahal who is also in charge of the Ministry of Industry, Commerce and Supplies. The minister proposed the session to pass the Bill. National Assembly member Sonam Gyaljen Sherpa demanded the government present a clear modality of investment for the people of the buffer zone. Tul Prasad Bishwakarma urged the government to bear in mind the existing Foreign Investment and Technology Transfer Act while proceeding with the Bill while Bhagawati Neupane stressed the need for cooperation among the federal, province, and local governments in the course of implementing a project or operating industry along the buffer zones. In response to lawmakers' queries, Minister Sharma said the amendment of some laws was mandated as per Nepal's commitments to enabling an investment-friendly atmosphere in the country it made during the April 28-29 Investment Summit. She said that revisions to the National Park Act, 2039 BS and the Forest Act are necessary and the relevant issues raised here will be further discussed and clarified during the amendment of those acts. The National Assembly shall meet again at 1:15 PM on July 11, Thursday. RSS",1,0
2024/8/19,"Catastrophic Flash Flood in Thame: Lawmakers suggest govt seek compensation from int’l community KATHMANDU, Aug 19: Members of Parliament (MPs) of the National Assembly (NA) have suggested that, as the glacier outburst is a significant effect of climate change, the Government of Nepal should seriously raise its voice on the international stage and demand compensation. KATHMANDU, Aug 19: Members of Parliament (MPs) of the National Assembly (NA) have suggested that, as the glacier outburst is a significant effect of climate change, the Government of Nepal should seriously raise its voice on the international stage and demand compensation. In the NA meeting on Sunday, MPs expressed their concerns, claiming that the recent floods in Solukhumbu are attributable to the effects of climate change. Stating that the impacts of climate change are increasing in Nepal, lawmaker Sonam Gelzen Sherpa emphasized that the government should address this issue seriously on the international stage and seek compensation. Due to the impact of climate change, the melting and outburst of glaciers in the Himalayas, landslides and droughts in the hilly regions, and floods in the Terai-Madhesh are becoming increasingly evident, he said. MP Sherpa further stated, ""The effects of climate change are becoming more evident in Nepal. I would like to draw the government's attention to how we should present this issue on the international stage."" He also urged the government to move forward on the issue of climate change in international forums. Sherpa demanded that the budget be allocated to work in the field of climate change and research to mitigate its effects. Another lawmaker, Jayanti Devi Rai, suggested that the residents of Khumbu Pasang Lhamu Rural Municipality-5, Thame of Solukhumbu, who were affected by the floods, should be relocated to a safer place. Stating that significant damage was caused by recent floods in Thame, Solukhumbu, MP Krishna Bahadur Rokaya emphasized the need to investigate the cause of the glacier outburst in the upper part of Thame. It is said that there are 21 glaciers in Nepal at risk of outbursts. Similarly, lawmaker Rukmini Koirala demanded that the government collect accurate details of the flood damage in Thame and compensate the affected victims. She also called for the government to study and provide information on whether the flood destruction in Thame is attributable to climate change. Lawmaker Gopi Bahadur Sarki Achami suggested that the government study the glaciers at risk and take preventive measures. He said, ""It is said that other glaciers are also at risk of bursting. However, whether the government is aware of this or not is unclear. The government should pay attention to the reconstruction of Thame and arrange for the rehabilitation of the victims.” Lawmakers argued that the damage caused by floods in Melamchi, Kagbeni, and Sudurpaschim was also attributable to climate change. Nepal's role in greenhouse gas emissions is negligible. However, Nepal is among the 19 countries in the world at high risk of the negative impacts of climate change. The United Nations Conference on Climate Change (COP) is held every year to find ways to mitigate the negative impacts of climate change. The COP-28, held last November in Dubai, United Arab Emirates, made historic decisions, including the beginning of the end of the fossil fuel era, the establishment of the Loss and Damage Fund, and various contributions to climate finance. Experts have argued that the Nepal government should inform the international community about the damage caused by the effects of climate change and lobby for compensation.",1,0
2024/8/25,"National Assembly members call for justice to usury victims KATHMANDU, Aug 25: Members in the National Assembly have demanded the government to ensure justice to the victims of usury. KATHMANDU, Aug 25: Members in the National Assembly have demanded the government to ensure justice to the victims of usury. In a meeting of the upper house of parliament on Sunday, they urged the government to focus on the effective implementation of relevant laws. Airing her views in the zero hour of the House session, MP Puja Chaudhary said that the victims have been denied justice despite the formulation of laws against usury. She called for a prompt action to ensure justice to them. Rukmini Koirala advised the government to implement measures for mitigating road accidents. She expressed her concerns over recent accidents including the deadly one in Tanahu. Bishnu Devi Pudasaini also advised the government to come up with measures to combat rising road accidents. Renu Chand demanded the government declare Sudurpaschim Province a tourist zone. She also urged the government to connect Badimalika and Tribeni region, the major tourist sites in the province, with reliable communications and drinking water facilities with the development of other infrastructure. Bishnu Bahadur Bishwakarma urged the government to investigate a case involving the death of a two-day infant in the Budhanilkantha-based Karuna Hospital and find out facts surrounding the incident. Krishna Prasad Adhikari expressed his concerns over the loss of 197 lives in monsoon disasters in the country, wanting the government to be sensitive towards that end. Meantime, usury victims demonstrated in Siraha on Saturday, accusing the government of being apathetic towards addressing their issues. They gathered at the local Golbazar to press the government to become responsible for resolving their problems. The Usury Victims Struggle Committee Chair Awadesh Kushawa said the ""accused continue to exploit them with the support of money, power and access.""",1,0
