date,content,female,male
2024/1/25,"UML candidate Koirala elected as National Assembly member from Koshi Province, defeats her rival from ruling coalition BIRATNAGAR, Jan 25: CPN-UML's candidate Rukmini Koirala has been elected as a member of the National Assembly, defeating the ruling coalition's candidate in Koshi. BIRATNAGAR, Jan 25: CPN-UML's candidate Rukmini Koirala has been elected as a member of the National Assembly, defeating the ruling coalition's candidate in Koshi. She defeated the candidate of the Maoist Center Champa Devi Karki by about 100 votes. Koirala, who secured the support of UML and Rastriya Prajatantra Party (RPP), got 5,086 votes, while Champadevi Karki, who got the support of Nepali Congress, CPN (Maoist Center), CPN (Unified Socialist) and Janata Samajwadi Party (JSP) got 4,992 votes.",1,0
2024/1/7,"Maoist Center finalizes candidates for National Assembly elections KATHMANDU, Jan 7: The CPN (Maoist Center) has finalized the names of its candidates for the National Assembly election. KATHMANDU, Jan 7: The CPN (Maoist Center) has finalized the names of its candidates for the National Assembly election. The party’s office-bearers' meeting held at the Prime Minister's residence, Baluwatar, decided the names of the candidates for all the six seats allocated for the party in the National Assembly. The meeting finalized the names of Champa Devi Karki from Koshi, Sri Krishna Adhikari from Bagmati, Manrupa Sharma from Gandaki, Bishnu BK from Karnali, Jhakku Subedi from Lumbini and Renu Chand from Sudurpaschim.",1,0
2024/1/7,"UML finalizes 19 candidates for upcoming National Assembly election KATHMANDU, Jan 7: The CPN-UML has finalized 19 candidates for the National Assembly elections scheduled for January 25. KATHMANDU, Jan 7: The CPN-UML has finalized 19 candidates for the National Assembly elections scheduled for January 25. UML General Secretary Shankar Pokharel announced the decision after a Secretariat meeting held on Sunday, where the names of the 19 candidates were finalized. He said that the selected candidates demonstrate a commitment to diverse representation, with a strategic focus on specific regions and communities. Rukmini Koirala (Sunsari) has been nominated to represent women from the Koshi Province, while Parshuram Adhikari (Bhojpur) will be the candidate from another category. UML has also designated Usha Devi Tharuni (Parsa) to represent women in the Madhes Province, and Dr Arjun Kumar Singh Rajput (Mahottari) for the category of ‘others’. The Bagmati Province will see Rochkumari Chaulagai (Dolakha) and Trilochan Nirmal Poudel (Chitwan) representing women, and Bibek Devkota (Kathmandu) representing the disabled-minorities. Additionally, Dhruba Raj Bishwakarma (Dhading) has been confirmed as the Dalit representative. In Gandaki Province, the women’s candidates include Yamanda Devkota (Gorkha), while Chakra Bahadur Parajuli (Syangja) represents the ‘others’ category, and Hemandra Sherchan (Mustang) is the nominee for the disabled-minorities category. The Lumbini Province will have Tulsa Kumari KC (Dang) representing women, and Jhapendra Bahadur Gharti Chhetri (Palpa) for the ‘others’ category. The Karnali Province’s nominees are Bimala Kumari Shahi (Humla) representing women, Dilli Prasad Bhatta (Mugu) for ‘others’ category, and Hikmat BK (Dailekh) as the Dalit representative. The Sudurpaschim Province will see Sabitra Devi Ghimire (Kailali) representing women, Iswari Prasad Kharel (Kanchanpur) for ‘others’ category, and Ram Chandra Joshi (Kailali) as the nominee for disabled-minorities.",1,0
2024/1/8,"Unified Socialist fielding two candidates for National Assembly election KATHMANDU, Jan 8: The CPN (Unified Socialist) has fielded two candidates for the National Assembly election scheduled for January 25. KATHMANDU, Jan 8: The CPN (Unified Socialist) has fielded two candidates for the National Assembly election scheduled for January 25. The party has picked Ghanashyam Rijal of Dolakha from the Dalit quota and Sabitri Malla of Dailekh from the women quota of Karnali Province as its candidates, according to the party deputy general-secretary and spokesperson Jagannath Khatiwada. The party's secretariat meeting on Sunday had given the responsibility of finalizing the candidacies to party Chairman Madhav Kumar Nepal, vice-chair Rajendra Pandey and general-secretary Ghanashyam Bhusal. RSS",1,0
2024/1/8,"JSP picks Puja Chaudhary as candidate for National Assembly election KATHMANDU, Jan 8: The Janata Samajwadi Party (JSP) has picked Puja Chaudhary as the candidate for the National Assembly (NA) elections. Chaudhary will file her nomination with the backing of the ruling coalition. KATHMANDU, Jan 8: The Janata Samajwadi Party (JSP) has picked Puja Chaudhary as the candidate for the National Assembly (NA) elections. Chaudhary will file her nomination with the backing of the ruling coalition. A Central Work Execution Committee meeting of the JSP held today finalized the candidacy of Chaudhary from Rautahat district, the party's publicity department chief Purna Basnet said.. Earlier, a meeting of the coalition partners agreed on joint candidacies for the upper house elections. As per the agreement, the NC will have 10 candidates followed by six from the CPN (Maoist Centre), two from the CPN (Unified Socialist) and one from the JSP. With the elections scheduled for January 25, today marks the publication of the voter name list, and tomorrow is the day for registrations of candidates. The final list of candidates is set to be published on January 11.",1,0
2024/10/20,"Visiting Chinese delegation calls on PM Oli KATHMANDU, Oct 20: A visiting Chinese delegation led by Chen Jining, a central committee member of the Communist Party of China and the Secretary for the Shanghai Municipal Committee, paid a courtesy call on Prime Minister KP Sharma Oli today. KATHMANDU, Oct 20: A visiting Chinese delegation led by Chen Jining, a central committee member of the Communist Party of China and the Secretary for the Shanghai Municipal Committee, paid a courtesy call on Prime Minister KP Sharma Oli today. During the courtesy meeting held at the Prime Minister's official residence in Baluwatar, discussions focused on strengthening bilateral relations between Nepal and China. Oli and Jining also discussed prospects of increased collaboration between their respective political parties - the Communist Party of Nepal (UML) and the Communist Party of China. The Prime Minister highlighted the role of the CPC and General Secretary Xi Jinping's leadership in alleviating poverty and driving holistic development in China, expressing Nepal's interest in benefiting from such advancements. The Prime Minister said the delegation about the coalition government formed by Nepal's two largest parties, the CPN-UML and the Nepali Congress, aimed at ensuring political stability. He expressed hopes for continued Chinese support for Nepal's economic development and stressed the need to regularise the exchange of high-level visits to enhance government-to-government, people-to-people, trade, cultural, and historical ties. Reaffirming Nepal's commitment to the One-China policy, the Prime Minister stated that no anti-China activities would be tolerated within Nepal's territory. In response, Chen said that his visit was directed by General Secretary Xi and reaffirmed China's support for Nepal’s happiness and prosperity, respecting the decisions made by Nepal's political parties. Ge said that the delegation would brief Xi on the topics that came up during the visit. Among those present at the meeting were the Prime Minister's Chief Advisor Bishnu Prasad Rimal; UML Secretary and Foreign Department Chief Raghubir Mahaseth; Department member Dr Anjan Shakya; the prime minister’s former foreign policy advisor Gopal Khanal; Joint Secretary at the Ministry of Foreign Affairs, Krishna Prasad Dhakal; and China’s Ambassador to Nepal, Chen Song.",1,0
2024/12/1,"Nepali parliamentary team leaves for Kuala Lumpur The Nepali parliamentary delegation went on an official study and observation visit at the invitation of the Government of Malaysia. The visit will last till December 6. KATHMANDU, Dec 1: National Assembly Vice-Chair Bimala Ghimire has left for Kuala Lumpur, Malaysia, leading a 13-member delegation on a parliamentary study and observation visit to Malaysia. The Nepali parliamentary delegation went on an official study and observation visit at the invitation of the Government of Malaysia. The visit will last till December 6. The delegation comprises Speakers of the Madhesh, Bagmati and Koshi provinces Ram Chandra Mandal, Bhuwan Kumar Pathak and Ambar Bahadur Bista, respectively. Similarly, the Deputy Speaker of Lumbini Province, Menuka Khand KC; Deputy Speaker of Gandaki Province, Bina Kumari Thapa; Deputy Speaker of Sudurpaschim Province, Koilidevi Chaudhary; and Deputy Speaker of Karnali province, Yashoda Neupane are also in the delegation. The Nepali parliamentary delegation will meet with the Speaker and Deputy Speaker of Malaysia as well as the Speaker and Deputy Speaker of Selangor Provincial Parliament of Malaysia in course of the visit, the Parliament Secretariat has stated. The delegation will return home on December 6.",1,0
2024/2/1,"Parliamentary committee instructs govt authorities to accelerate preparation for COP-29 KATHMANDU, Feb 1: The Parliamentary Committee for Sustainable Development and Good Governance has instructed the government to expedite preparation for upcoming COP-29. KATHMANDU, Feb 1: The Parliamentary Committee for Sustainable Development and Good Governance has instructed the government to expedite preparation for upcoming COP-29. The Committee here on Wednesday held discussion on recently held climate conference- COP-28 and reviewed Nepal's participation in it besides deliberating on Nepal's upcoming action plan in regard to COP-29. Committee Chair Prakash Panth said that it was necessary to formulate action-plan to make participation in COP-29 more organized and effective, with timely review of the COP-28. Panth also directed the government to accelerate preparation to make cooperation with international organizations on climate action further effective. He was also instructed to devise action-plans in consultation with the multifaceted stakeholders. Secretary of the Committee, Dr Rojnath Pandey, pressed for materializing the plan of 'Sagarmatha Sambad' (Everest Dialogue) and climate conference raised in the COP-28 held from November 30 to 12 December, 2023 in the UAE. He said that priority be accorded on capitalizing on the achievements of the conference and collection of data. Similarly, Joint-Secretary at the Ministry of Forest and Environment, Dr Buddhi Sagar Poudel, said that COP-28 had prioritized the 'Save Mountain and Hill' campaign. He highlighted the need for more collaboration and cooperation to make upcoming COP-29 more effective. National Inclusion Commission's Chairperson Dr Ramkrishna Timalsina and Madheshi Commission's member Renu Shah called for incorporating climate change related issues in the school's curriculum. National Women Commission's Chairperson Kamala Kumari Parajuli underlined the need for a three-tier government to maintain consistency between gender-responsive budget and climate-targeted budget considering the fact that women and children were the most affected group by climate change. National Dalit Commission Chairperson Devraj Bishwakarma, Indigenous Nationalities Commission's Chairperson Ram Bahadur Thapa Magar and Tharu Commission's Chairperson Bishnu Prasad Chaudhary univocally emphasized launching programmes that were targeted to marginalized communities as, they said, that the marginalized communities were most affected by impact of climate change. Parliamentarian Bir Bahadur Balayar viewed that the budget allocated by the ministries must be targeted at achieving Sustainable Development Goals. He opined that the country should be capable of managing the adverse impact of climate change. Other parliamentarians such as Mina Tamang, Binita Kathayath and Bimala Ghimire among others saw the need for raising a nation-centric agenda in the upcoming climate conference. Participants of the meeting stressed on devising clear policies for climate action, further strengthening coordination and cooperation among stakeholders to make upcoming climate conferences more effective and presenting result-oriented agendas and forming effective coordination between the civil employees and politicians. (RSS)",1,0
2024/2/26,"LMC presents report in National Assembly KATHMANDU, Feb 26: In a meeting of the National Assembly today, the annual report of the Legislative Management Committee (LMC) was presented. KATHMANDU, Feb 26: In a meeting of the National Assembly today, the annual report of the Legislative Management Committee (LMC) was presented. Committee Chair Jayanti Devi Rai presented the report of the fiscal year 2079-80 BS (2022-23), informing the upper house of the Federal Parliament that the Committee held a total of 54 meetings in a year. Similarly, National Concern and Coordination Committee Chair Dil Kumari Rawal Thapa (Parbati) presented a study report on the situation of human-wildlife conflict in national parks, wildlife reserves and buffer zones-2080 BS in the meeting. National Assembly Chairman Ganesh Prasad Timilsina read out a letter sent by the Office of the Prime Minister and Council of Ministers regarding the allocation of portfolios of the members in the Council of Ministers. RSS",1,0
2024/2/29,"UML demands release of microfinance victims KATHMANDU, Feb 29: The CPN-UML has demanded the release of microfinance victims. KATHMANDU, Feb 29: The CPN-UML has demanded the release of microfinance victims. The police arrested the microfinance victims who staged a protest by entering the Federal Parliament building premises. National Assembly member Bimala Ghimire urged the government to release the microfinance victims and address their grievances. Speaking at the National Assembly meeting on Thursday, she drew the attention of the government to address the demands of microfinance and loan shark victims who are protesting in Kathmandu. She emphasized that since the government did not respond to their grievances, the microfinance victims felt compelled to protest on the Parliament premises. ""Those detained during the demonstration should be released immediately and unconditionally,"" she asserted. On February 26, microfinance victims staged a demonstration on the premises of the Federal Parliament Building in New Baneshwor.",1,0
2024/2/7,"National Assembly approves report of Draft Committee on Amendment of National Assembly Regulations-2075 BS KATHMANDU, Feb 7: National Assembly (NA) has unanimously approved the report of the Draft Committee on the Amendment of National Assembly Regulations-2075 BS. KATHMANDU, Feb 7: National Assembly (NA) has unanimously approved the report of the Draft Committee on the Amendment of National Assembly Regulations-2075 BS. Chairman of the Draft Committee Suresh Kumar Ale Magar presented the proposal seeking consideration of the Amendment Report on National Assembly Regulations-2075 BS in the beginning of the meeting. In the theoretical discussions held on the proposal, President Ale Magar responded to all the queries raised by the lawmakers. National Assembly Chairman Ganesh Prasad Timilsina apprised the Committee members that those seeking amendments on the report could register their amendment within 72 hours. Similarly, the meeting unanimously endorsed Fiscal Procedures and Financial Accountability (First Amendment) Ordinance-2080 BS. Likewise, Legislative Management Committee President Jayanti Devi Rai presented a report of the Committee on Sahid Dasaratha Chand Health Science University-Bill-2080 BS. Meanwhile, the NA meeting passed the condolence motion on the demise of former minister and constituent assembly member Keshav Kumar Budhathoki. The condolence motion was presented by the NA Chairperson which the meeting endorsed unanimously. Parliamentarians observed a minute of silence and prayed for the eternal peace of departed Budhathoki. Budhathoki passed away on February 5 while undergoing treatment. He was 80. The National Assembly is convening again on February 11 at 1:01PM. (RSS)",1,0
2024/3/1,"Upper House lawmakers call for prioritizing job creation in budget KATHMANDU, March 1: National Assembly lawmakers, speaking in a discussion on the principles and priorities of the Appropriation Bill for the upcoming fiscal year, called for giving emphasis on employment generation and mobilization of youth by upholding good governance. KATHMANDU, March 1: National Assembly lawmakers, speaking in a discussion on the principles and priorities of the Appropriation Bill for the upcoming fiscal year, called for giving emphasis on employment generation and mobilization of youth by upholding good governance. Finance Minister Dr Prakash Sharan Mahat had presented the Principles and Priorities of Appropriation Bill for the next fiscal year in the meeting of the National Assembly, the upper house of the Federal Parliament, on February 26. Taking part in the debate in the NA meeting on Thursday, lawmakers underscored on making the budget functional. Similarly, they emphasized on giving high priority to the agriculture sector, ensuring security to the health workers, making clear the responsibilities on service delivery of the three tiers of government, bringing a plan for consumption of electricity produced in Nepal within the country itself and also on increasing capital expenditure and revenue collection. Prakash Pantha, Dil Kumari Rawal (Parbati), Dr Khimlal Devkota among other lawmakers participated in the discussions. Dr Devkota on the occasion drew the attention of the government, saying those ministers who were supposed to participate in the meeting were not present in the meeting. President of the Legislation Management Committee, Jayanti Devi Rai, presented the Bill on Anti-Money Laundering and the Promotion of Business Environment, 2079 BS during Thursday’s meeting. She also presented the report of the onsite study programme on law-making process and practices of the local levels. Similarly, the upper house lawmakers also drew the attention of the government towards the difficulties faced by the people for lack of drinking water and irrigation facilities in the Terai-Madhesh region. They expressed their concern on this issue while speaking in the 'zero hour' of the National Assembly meeting on Thursday. Lawmaker Tulasa Kumari Dahal called on the government to make arrangements for providing pure drinking water to the people in the Madhes. She also stressed on conservation of the Chure ecosystem by stopping its over-exploitation and on making arrangements for irrigation in the Madhes which is the 'breadbasket' of the country. Lawmaker Jaga Prasad Sharma called for putting an end to the trend of meager expenditure of the budget allocated for big projects, drawing the government's attention to finding a solution to this problem. Taraman Swanr called on the government to expedite the construction of the Seti and Mahakali highways, considered as the backbone for the economy and development of the Sudurpaschim Province and to ensure a budget for these road projects in the next fiscal year. Bimala Ghimire drew the attention of the government for immediately addressing the demands of farmers and the victims of loan sharks. Lawmaker Sumitra BC called for immediately taking ahead the process for reconstruction of houses of the earthquake-affected people of Jajarkot who are still living under tents even after nearly four months since the disaster. RSS",1,0
2024/3/22,"HoR session suspended for 10 days as Speaker-led team departs for Switzerland KATHMANDU, March 22: In the midst of parliamentary inactivity with bills pending discussion and budgetary matters unaddressed, a 10-member delegation led by Speaker Devraj Ghimire has departed for Geneva, Switzerland. This team is attending the 148th General Assembly of the Inter-Parliamentary Union (IPU) from March 23 to March 27. KATHMANDU, March 22: In the midst of parliamentary inactivity with bills pending discussion and budgetary matters unaddressed, a 10-member delegation led by Speaker Devraj Ghimire has departed for Geneva, Switzerland. This team is attending the 148th General Assembly of the Inter-Parliamentary Union (IPU) from March 23 to March 27. Following the departure of Speaker Ghimire's delegation, sessions of the House of Representatives have been adjourned for 10 days. Assistant Spokesperson for the Federal Parliament Secretariat, Dashrath Dhamala, confirmed that the team embarked on their journey via a Qatar Airlines flight. The delegation includes Padma Prasad Pandey, the General Secretary of the Federal Parliament Secretariat; Ekram Giri, Joint Secretary and Spokesperson; Under Secretary Pradeep Guragain; and Tejprakash Bhattarai, the Chief Personal Secretary to the Speaker. Representatives from various political parties are also part of the delegation: Ramesh Lekhak, Chief Whip of the Nepali Congress Parliamentary Party; Mahesh Kumar Bartaula, Chief Whip of UML; Hitraj Pandey, Chief Whip of the Maoist Center; and Santosh Pariyar, Chief Whip of the Rastriya Swatantra Party. Additionally, Ganga Kumari Belbase, a member of the National Assembly, is included in the team. During the assembly, Speaker Ghimire is expected to deliver a statement on parliamentary diplomacy, focusing on fostering peace and understanding. The Secretary General of the Federal Parliament will also participate in various meetings of the organization, according to Assistant Spokesperson Dhamala.",1,0
2024/3/28,"National Assembly Vice Chairperson Aryal resigns KATHMANDU, March 28: National Assembly Vice Chairperson Urmila Aryal has resigned. She submitted her resignation letter to National Assembly Chairman Narayan Dahal on Thursday. KATHMANDU, March 28: National Assembly Vice Chairperson Urmila Aryal has resigned. She submitted her resignation letter to National Assembly Chairman Narayan Dahal on Thursday. It was agreed that the CPN (Maoist Center) would take over the chairmanship of the National Assembly in the power coalition. According to that agreement, Narayan Dahal has become the chairperson of the National Assembly. Aryal has resigned as the post of National Assembly vice-chairperson has been given to another party in the ruling coalition. Earlier, in the written agreement between the ruling coalition CPN-UML, Maoist Center, and Rastriya Swatantra Party (RSP), it was mentioned that the UML would take the post of National Assembly Vice-Chairperson. But later, after the CPN (Unified Socialists) also joined the new coalition, nothing was mentioned about the post of National Assembly Vice Chairperson in the new written agreement. It is speculated that the CPN (Unified Socialist) would nominate the candidate for the post of vice-chairperson of the National Assembly.",1,0
2024/3/29,"Speaker-led delegation returns home KATHMANDU, March 29: A 10-member delegation led by Speaker of the House of Representatives (HoR), Devraj Ghimire, has returned home from Switzerland after participating in the 148th General Assembly of the Inter-Parliamentary Union (IPU). KATHMANDU, March 29: A 10-member delegation led by Speaker of the House of Representatives (HoR), Devraj Ghimire, has returned home from Switzerland after participating in the 148th General Assembly of the Inter-Parliamentary Union (IPU). The delegation had left for Switzerland on March 21 to participate in the General Assembly held at the IPU head office from March 23 to 27. In the General Assembly, Speaker Ghimire delivered a speech on behalf of the Federal Parliament on the topic of 'Parliamentary Diplomacy: Building Bridges for Peace and Understanding'. Along with Speaker Ghimire, the chief whips of the parliamentary parties of the Nepali Congress Ramesh Lekhak, CPN (UML)'s Mahesh Kumar Bartaula, CPN (Maoist Center)’s Hitraj Pandey and Rastriya Swatantra Party's Santosh Pariyar participated in the event. Similarly, National Assembly Member Ganga Kumari Belbase, Federal Parliament Secretariat Spokesperson Ekram Giri, Deputy Secretary Pradeep Guragain, and Speaker's Chief Private Secretary Tejprakash Bhattarai attended the event. RSS",1,0
2024/4/10,"UML's Ghimire elected as National Assembly Vice Chair KATHMANDU, April 10: Bimala Ghimire, the candidate representing CPN-UML, has been elected as Vice Chairperson of the National Assembly. KATHMANDU, April 10: Bimala Ghimire, the candidate representing CPN-UML, has been elected as Vice Chairperson of the National Assembly. Ghimire secured victory with a significant majority during the voting session held in today's meeting of the upper house of the federal parliament. Out of 55 lawmakers present during the voting, Ghimire secured victory by garnering 39 votes. The National Assembly has a total of 59 members.",1,0
