date,content,female,male
2024/2/8,"Man dies in Ireland after contracting measles The HSE’s Health Protection Surveillance Centre said the man died in a hospital in the Dublin and Midlands Health Region. It is the first confirmed measles case in Ireland this year. A man has died in Ireland after contracting measles, the HSE has confirmed. The HSE’s Health Protection Surveillance Centre said the man died in a hospital in the Dublin and Midlands Health Region. It is the first confirmed measles case in Ireland this year. Sign up to IrishCentral's newsletter to stay up-to-date with everything Irish! The HSE has established a Measles National Incident Management Team (IMT) in response to a rise in measles cases in the UK and mainland Europe amid falling vaccination rates. The health service said the IMT is taking all necessary public health actions in relation to the case. There were four confirmed measles cases in Ireland in 2023, two in 2022, none in 2021, and five in 2020, with no deaths reported in each of those years. Professor Breda Smyth, Ireland's Chief Medical Officer, encouraged people to take up the measles, mumps, and rubella (MMR) vaccine, adding that she is ""very concerned"" about a measles outbreak in Ireland. In a post on social media on Thursday morning, Smyth said Ireland needs to ""prevent as many cases, serious illnesses, and deaths as possible"". A video posted alongside the statement warned that vaccination levels in Ireland have fallen below 90% nationally and below 80% in some counties. Speaking in the video, Smyth said vaccination levels needed to be above 95% to prevent measles from spreading. There has been a confirmed death of an adult in Ireland linked to measles infection. We need to prevent as many cases, serious illnesses and deaths as possible. Please get your MMR vaccine. See https://t.co/kQT8OUIL48 pic.twitter.com/Istk5mVW07 The video was originally published on January 26 and has now been reshared following the first confirmed measles case of 2024. Meanwhile, the HSE said it offers the MMR vaccine to all children in Ireland as part of its childhood immunization schedule. The health service added that any concerned parents should contact their GP. Minister for Health Stephen Donnelly briefed the Cabinet on Tuesday that a rise in cases across Europe this winter, coupled with falling vaccination rates in Ireland, has raised fears about transmission of the disease in Ireland in 2024. The World Health Organisation has also issued an urgent measles warning after reporting a 30-fold increase in cases in Europe. The WHO reports that more than 30,000 measles cases were confirmed across Europe in the first nine months of 2023 compared to just 1,000 cases in the whole of 2022. Measles is a highly contagious disease that can lead to severe complications. It can take up to 14 days for symptoms to appear, with patients typically suffering from a runny nose, a cough, temperature, and red, watery eyes. These symptoms are generally followed by a rash, which appears a few days later.",0,1
2024/2/9,"New ‘Ireland House’ to open in Chicago, Tánaiste announces during US visit Ireland House in Chicago will ""play a central role in unlocking potential and new opportunities that will benefit both Ireland and the Midwest.” Ireland’s Tánaiste and Minister for Foreign Affairs Micheál Martin TD announced today, February 8, that the Irish Government will open a new ‘Ireland House’ in Chicago later this year. Ireland House, to be located on the city’s Michigan Avenue, will house the Consulate General of Ireland together with representatives of Ireland’s economic and trade promotion agencies, Ireland’s Department of Foreign Affairs (DFA) said on Thursday. The announcement comes as the Tánaiste visits Chicago for a series of political, business, and community engagements. The opening of Ireland House in Chicago this autumn will coincide with the centenary of the establishment of diplomatic relations between Ireland and the US. Sign up to IrishCentral's newsletter to stay up-to-date with everything Irish! Ireland's DFA said on Thursday: ""This new showcase premises is part of Ireland’s continuing investment in a deepened and integrated diplomatic, economic, and cultural engagement in Chicago, Illinois, and across the wider Midwest of the United States, a region with a significant Irish diaspora and strong and mutually beneficial economic relationships with Ireland. ""The Midwest has a population of over 50 million, including some five million Irish Americans, and a GDP of $3.5 trillion, with a highly diversified economy. The region is home to over 100 Irish companies employing almost 25,000 people, while 312 IDA client companies in the US Midwest & South region employ almost 62,000 people in Ireland."" Welcoming the announcement, the Tánaiste said: “Our Strategy for the United States sets out a clear commitment to strengthening our relationships with States and regions across the country. ""Opening a new Ireland House in Chicago is a clear signal of this intent and of our desire to grow Ireland’s connections in Chicago and the wider Midwestern United States. “Our historic relationships here are built on an energetic and engaged Irish community and vibrant economic and cultural links. Ireland House Chicago will mark a new and exciting chapter and play a central role in unlocking potential and new opportunities that will benefit both Ireland and the Midwest.” Delighted to announce that we will open a new Ireland House in Chicago later this year.https://t.co/E8QE2Ghreg pic.twitter.com/qhsbL5DEaA Mayor of Chicago, Brandon Johnson, said: ""We warmly welcome Ireland House to the great city of Chicago. ""This is a testament to the enduring bond between Chicago and Ireland, including our cherished sister city, Galway. ""We invite Irish visitors and businesses to visit and experience the beauty of our city. We look forward to collaborating with the Consulate General of Ireland to ensure that this hub not only opens doors to enhanced economic opportunities but also fosters cultural exchanges."" Warm welcome from ⁦@ChicagosMayor⁩ Brandon Johnson. Ireland is proud of the part it played in shaping this great city. Good discussion on economic and education opportunities, and shared challenges & progress on affordable housing. pic.twitter.com/A7Ojmzg1Gg The Tánaiste was in Chicago on Thursday as part of his US visit this week that also saw him visit Washington, DC, where he met with some of America's leading politicians. In Chicago on Thursday, the Tánaiste met with members of the local Irish community and thanked them ""for everything you do to maintain and strengthen the bonds with Ireland."" Enjoyable meeting members of our thriving and vibrant Irish community in Chicago. Thanks for everything you do to maintain and strengthen the bonds with Ireland. pic.twitter.com/itEsMGnXiE He also met with Governor of Illinois JB Pritzker and said that there is ""enormous potential"" for growing the friendship between Ireland and Chicago even further. A great pleasure to meet ⁦@GovPritzker⁩ to celebrate Ireland’s bonds with Chicago and Illinois. Enormous potential for growing that friendship even further in the coming years. pic.twitter.com/VovrJzbVW8 The Tánaiste's visit to the US comes not long before 11 Irish politicians head stateside in March as part of the Irish Government's annual St. Patrick's Day Programme, which this year aims to promote ""Ireland's Future in the World.""",0,1
2024/3/11,"Taoiseach begins week-long US visit for St. Patrick's Day Taoiseach Leo Varadkar will be visiting Boston from Monday evening before traveling to Washington, DC for more St. Patrick's Day engagements. Taoiseach Leo Varadkar has begun an official visit to the United States for a series of political, economic, and community engagements as part of the traditional St. Patrick's Day celebrations. Varadkar will arrive in Boston on Monday evening, March 11 and will undertake a series of political, economic, and Irish community engagements before traveling to Washington later in the week for a bilateral meeting with President Joe Biden and the traditional shamrock ceremony. The Taoiseach will deliver a keynote address at the President John F. Kennedy Library on Monday evening and will also meet with Governor of Massachusetts Maura Healy to discuss the deep cultural and economic ties between her state and Ireland. On Tuesday, Varadkar will host a series of economic meetings before traveling to Fenway Park to announce a major investment by Irish sports data company Output Sports. He will speak at a Young Ireland Funds Leaders event later on Tuesday and will attend a breakfast hosted by the Irish American Partnership on Wednesday morning before departing for Washington. Sign up to IrishCentral's newsletter to stay up-to-date with everything Irish! His first engagement in Washington will be to speak at the Ireland Funds National Gala Dinner on Wednesday night before speaking at a series of events hosted by Enterprise Ireland, the IDA, and the US Chamber of Commerce on Thursday. The Taoiseach will meet with senior Irish and US executives to ""explore how the Ireland-US two-way trade and investment partnership can help create more jobs and growth in both countries."" Varadkar will meet bilaterally with President Joe Biden, Vice President Kamala Harris, and Speaker of the House of Representatives Mike Johnson on Friday, with discussions expected to cover a wide range of issues, including the 100th anniversary of diplomatic relations between Ireland and the US. The Taoiseach is also expected to thank Biden for the US's continued commitment to the Good Friday Agreement and peace in Northern Ireland. Varadkar will also raise the concerns of Irish people over the ""shocking crisis in Gaza,"" the Taoiseach said in a statement. He added that he will reiterate Ireland's call for a ceasefire to allow humanitarian aid into Gaza during the visit. ""My visit to the US comes at a crucial time in global affairs and US leadership is needed more now than ever. I look forward to discussing with President Biden, and leaders on Capitol Hill, our shared commitment to continued support for Ukraine in the face of Russian aggression,"" Varadkar said in a statement. ""I will also raise the concerns of the Irish people on the shocking crisis in Gaza, reiterating our call for an immediate and sustainable ceasefire to facilitate a massive increase in the humanitarian aid that can reach desperate people and the immediate and unconditional release of the remaining hostages."" He noted that the Government's theme for St. Patrick's Day 2024 is ""Ireland's Future in the World"" and said he hopes to celebrate the achievements of Ireland's ""young diaspora leaders in the US."" ""Many of the events in both Boston and Washington DC will enable me to recognize their invaluable contribution to sustaining and deepening the close bonds between Ireland and the US, now and into the future. ""My visit is also an opportunity to highlight our strong and growing trade and investment relationship, a relationship that is increasingly balanced and two-way."" Varadkar's visit will conclude with the traditional shamrock ceremony in the White House on Sunday, March 17, which will see the Taoiseach present Biden with a crystal bowl of Irish shamrocks.",0,1
2024/3/12,"Taoiseach calls for ceasefire in first public address of his US St. Patrick’s Day visit Taoiseach Leo Varadkar said ""Ireland will continue to call for an immediate ceasefire"" during a speech at the JFK Library in Boston. Taoiseach Leo Varadkar called for a ceasefire in Gaza during his keynote address at the John F. Kennedy Presidential Library and Museum in Boston, Massachusetts on Monday, March 11. ""What happened on the 7th of October was an act of pure evil and hatred, and it can never be forgotten, contextualized, or excused,"" Varadkar said in his address. ""Colleagues, when thousands of children are killed in response no one can avert their eyes. ""The life of a child is the greatest gift of all. Childhood should be a blessing. Today in Gaza, for so many children it is a death sentence and a curse. ""We all know that there are guilty people who perpetrated unspeakable acts of terrorism. But there are innocent men, women and children who are suffering for their sins. They should not be subject to collective punishment. ""The cries of the innocent will haunt us forever if we stay silent. ""The cries will engender radicalism, and beget more violence and more vengeance. ""No child ever gave their consent for acts of terrorism in Ireland or Israel or anywhere else. No child should ever be punished for them. ""It is unconscionable that they are dying not just as a result of relentless bombing and destruction, but of hunger and thirst and the absence of basic medical care. ""If we are not consistent – if we do not see and respect the equal value of a child of Israel and a child of Palestine – then the rest of the world, in particular the Global South, which after all is most of the world, will not listen when we call on them to stand by the rules and institutions that are the bedrock of a civilized world. ""In this scenario, we will all be losers and our world will be infinitely less secure. ""Consistent application of international law and international humanitarian law – to state and non-state actors alike – has to be the basis on which the international community engages with one another. ""So, Ireland will continue to call for an immediate ceasefire, the unconditional release of all hostages, and a massive and sustained increase in humanitarian aid, food, and medicine to the people of Gaza. ""We will also continue to call and to work for a meaningful political pathway leading to self-determination for the Palestinian people. A fully-fledged nation-state of their own, and homeland in the land of their forefathers. ""From our own painful history in Ireland, we know that a ceasefire does not mean surrender, nor does it necessarily mean peace, and it certainly doesn’t mean weakness. A ceasefire does not mean forgiveness either, but it does present a symbol of hope. It means breaking free of the perpetual cycle of violence, recrimination and retaliation. It means believing in our shared humanity instead of a need for revenge."" Taoiseach Leo Varadkar gave the keynote speech last night at @JFKLibrary in Boston as part of #StPatricksDay2024 US visit. pic.twitter.com/sLtL4sKcOp Sign up to IrishCentral's newsletter to stay up-to-date with everything Irish! The Taoiseach delivered his keynote on Monday after arriving in the US earlier that day to begin his week of St. Patrick's Day engagements. Ahead of his visit, the Taoiseach, as well as other Irish politicians, were facing calls to boycott their annual visits to the US due to the American response to the war in Gaza. The Taoiseach, however, said it would be a ""big mistake"" to skip the visit. Elsewhere in his speech on Monday evening, the Taoiseach said ""Ireland has always been a true friend to the United States."" On Tuesday evening, the Taoiseach is due to speak at the Ireland Funds Young Leaders event in Boston and on Wednesday morning, he will attend a breakfast hosted by the Irish American Partnership before heading to Washington, DC. In Washington DC, the Taoiseach’s first engagement will be speaking at the Ireland Funds National Gala Dinner on Wednesday evening. On Thursday, he will attend and speak at a series of events hosted by Enterprise Ireland, the IDA, and the US Chamber of Commerce. On Friday, the Taoiseach will meet bilaterally with President Joe Biden, Vice President Kamala Harris, and the Speaker of the US House of Representatives. On Sunday, St. Patrick's Day, the Taoiseach will attend the White House St. Patrick’s Day reception, which will feature the traditional shamrock ceremony.",0,1
2024/3/13,"Celebration of Charlie Bird's life announced as tributes pour in for Irish journalist Charlie Bird's life will be celebrated with a service in Dublin this week as tributes continue to pour in for the Irish journalist and advocate. A service to celebrate the life of Charlie Bird, the renowned Irish journalist and motor neurone disease advocate, will be held on March 14 in Dublin. Bird “died peacefully in the wonderful care of Wicklow Hospice with his family at his side” on Monday, March 11, a notice on RIP.ie says. “Sadly missed by his beloved wife, Claire, loving daughters Orla and Neasa, little wingman Tiger, his sons-in-law Rob and Aidan, adored grandchildren Charlie, Hugo, Abigail, Harriet and Edward, his extended family, former colleagues and a wide circle of friends both at home and abroad. Remembering also Orla and Neasa’s late mother Mary.” The notice adds: “A service to celebrate Charlie's life will be held on Thursday, March 14 at 12 noon in the Round Room, Mansion House, Dublin 2. “No flowers please. “Donations, if desired, to Wicklow Hospice.” Dublin-born Bird was renowned for his long and distinguished career in broadcasting and journalism. In the wake of his motor neurone disease (MND) diagnosis in October 2021, he turned to charity work and raising awareness about the disease. In January 2022, just months after his diagnosis, Bird launched the ""Climb with Charlie"" charity climb of Croagh Patrick in Co Mayo. Held in April, the event spurred some 200 ""Climb with Charlie"" fundraisers across Ireland and ultimately raised €3.4 million for a number of charities, including the Irish Motor Neurone Disease Association and Pieta. Sign up to IrishCentral's newsletter to stay up-to-date with everything Irish! Tributes to Bird have been widespread in the wake of his death on Monday. President of Ireland Michael D. Higgins extended his deepest condolences, writing: ""It is hard to understate the impact which Charlie’s work to ‘Extend the Hand of Friendship’ has had on our country."" Statement by President Higgins on the death of Charlie Bird https://t.co/LCg1MdEKdC pic.twitter.com/YENhoanMpH Taoiseach Leo Varadkar said in a statement: ""Charlie Bird was a hugely talented journalist and an inspirational person, who will be sadly missed. ""He had the trust and respect of the Irish people as he reported on events from all over the world as well as here in Ireland."" Tanaiste Micheál Martin said that Bird's ""message of generosity, friendship, and simply looking out for each other will long be remembered."" He memorably covered national & international events such as the Peace Process, the Sept 11 attacks, the Gulf War, and the National Irish Bank scandal. Personable and engaging, Charlie had the public interest at heart, representing public service broadcasting at its very best. Lillian McGovern, CEO of the Irish Motor Neurone Disease Association (IMNDA), said in part: ""We will forever be grateful for the impact Charlie has made for the IMNDA, not only in terms of funding, which has so greatly helped us improve how we can support families; but also in terms of the impact his presence has had on creating awareness, getting people to sit up and take notice of what is truly a devastating disease. ""In many ways, Charlie started the important conversation, and it is up to all of us to continue it in his honour."" We @IMNDA are deeply saddened to learn of the passing of the wonderful & truly inspirational Charlie Bird. Our heartfelt condolences to Charlie’s wife Claire, children Neasa and Orla, his grandchildren & of course his beloved dog Tiger. Lillian McGovern CEO @IMNDA pic.twitter.com/FxHLdgnqfC Stephanie Manahan, CEO of Pieta, said Bird, an Ambassador for Pieta, ""was an incredible force for good, and a wonderful and generous person who worked tirelessly to extend the hand of friendship to a range of good causes."" Pieta also shared information about the legacy Bird left at Pieta. Charlie was also instrumental in establishing the Pieta and Belong To partnership. We send our deepest condolences to Claire, friends and family and everyone Charlie impacted in his life. May he rest in peace. ? pic.twitter.com/ZdfVcWUzku Books of Condolences have been opened in Dublin and Co Wicklow.",0,1
2024/3/13,"Washington Ireland Program Class of 2024 announced in Washington, DC The Washington Ireland Program Class of 2024 features 30 high-potential emerging leaders from across Northern Ireland and Ireland. Rep. Mike Kelly and Rep. Mary Gay Scanlon launched the Washington Ireland Program Class of 2024 at a special event in Washington DC today, March 13, as the program celebrates its 30th year. The new class will see 30 high potential emerging leaders from across Northern Ireland and Ireland venture state-side this summer as part of the prestigious transatlantic program. For three decades, the Washington Ireland Program (WIP) has played an important role in post-conflict Northern Ireland and Ireland by bringing together leaders from a wide range of communities and backgrounds for outstanding leadership and skills-development programs. WIP’s aim is to support, inspire, and develop leaders who are committed to building a future of peace and prosperity for Northern Ireland and Ireland. Sarah Selfati Harte, Trinity College Dublin, Nicola Skelly, Executive Director, Washington Ireland Program, and Daithí O’Toole, Ballyfermot College of Further Education. Sign up to IrishCentral's newsletter to stay up-to-date with everything Irish! WIP has a diverse community of over 900 Alumni who are delivering on that vision - including Taoiseach Leo Varadkar (Class of 2000), Deputy First Minister Emma Little-Pengelly MLA (Class of 2002), and Leader of the Opposition Matthew O'Toole MLA (Class of 2004). The WIP Alumni community also includes tech entrepreneur Aidan Corbett (Class of 2005), award-winning artist Adrian Margey (Class of 2005), and disability rights activist Alannah Murray (Class of 2019). As the 30th class to embark on the prestigious program, the 2024 cohort have already demonstrated their leadership potential, have a strong track record of service, and are committed to building a bright future for the island of Ireland. Over a third of the students come from economically disadvantaged backgrounds and will receive full scholarships to participate. Previous students have completed work placements in the offices of Senator Chuck Schumer, John McCain, and Hillary Clinton. The Program has been applauded by President Joe Biden as an example of the “special” relationship between Ireland and America. Disha Suresh, Queen’s University Belfast, Nicola Skelly, Executive Director, Washington Ireland Program, and Eoin Millar, Ulster University. Rep. Mike Kelly said at the announcement: “As co-chair of the Congressional Friends of Ireland Caucus, I am honored to announce the incoming Class of Washington Ireland Program Emerging Leaders. ""We have had WIP interns in our office for many years and many of them have gone on to pursue careers in public service. ""I am proud of the role that the United States has played in the peace process in Northern Ireland and Ireland, and I commend the Washington Ireland Program for their work in investing in new generations of leaders to sustain that peace.” Rep. Mary Gay Scanlon added: “Congratulations to the Washington Ireland Program for 30 years of inspiring new generations of leaders to build peace and prosperity on the island of Ireland. ""The Washington Ireland Program plays a unique role in strengthening and reinvigorating the ties between Northern Ireland, Ireland, and the US, and I am proud to support its work. ""I look forward to meeting the Class of 2024 this summer and welcoming another intern to my office.” United States Members of Congress Rep. Mike Kelly and Rep. Mary Gay Scanlon launched the Washington Ireland Program Class of 2024 at a special event in Washington DC today, as the program celebrates its thirtieth year. @WIPLive pic.twitter.com/9NcOx1gvnn Nicola Skelly, Executive Director of the Washington Ireland Program said: “We are thrilled to launch the WIP Class of 2024 today in Washington DC with our special guests. ""Over the year ahead, these emerging leaders will develop their leadership skills through personal development, policy debate, work placement opportunities, and service. They will have unparalleled access to global leaders through our Speaker Series and will be challenged to develop ambitious ideas which shape the future of the island of Ireland. The relationships these young people will build with each other, and the broader WIP community will be formative in their lives, and we are proud to be part of their leadership journey.”",0,1
