date,content,female,male
2024/6/16,"Taoiseach supports Rhasidat Adeleke following online racist abuse Adeleke, who won one gold medal and two silver at the recent European Athletics Championships in Rome, was targeted with racist slurs by online trolls, according to her coach Edrick Floreal. Taoiseach Simon Harris has urged Irish athletics star Rhasidat Adeleke to not let ""online cowards"" impact her after her coach detailed the racist abuse she has received over the past few months. Adeleke, who won one gold medal and two silver at the recent European Athletics Championships in Rome, was targeted with racist slurs by online trolls, her coach Edrick Floreal told Q102′s Weekend Sports Breakfast. Floreal said the racist abuse impacted Adeleke, who was left in a ""dark place"". Sign up to IrishCentral's newsletter to stay up-to-date with everything Irish! In a statement on X, formerly Twitter, Harris described Adeleke as a ""world-class person"" and said the country was proud of her. ""Rhasidat Adeleke is not only a world-class champion, she is a world-class person. You have inspired a nation this week, especially young girls & boys. You are class, so please do not let online cowards bring you down. You are Ireland and Ireland could not be more proud of you,"" Harris said in a post on X. Sport Against Racism Ireland (SARI) said it was ""appalled but unsurprised"" to learn that Adeleke had been subjected to online abuse. ""SARI (Sport Against Racism Ireland) is appalled but unsurprised that one of Ireland’s magnificent young athletes, Rhasidat Adeleke, who gave the nation such joy at last week’s European Athletic Championships in Rome, has suffered racial abuse online,"" Sari said in a statement. ""It is shocking that one person - the only black member of a wonderfully talented team of athletes - can be targeted in this manner. This is another wake-up call for our legislators and those who govern Irish sport. ""Unfortunately, working at the frontline of diversity and inclusion for decades, SARI has little confidence that institutional Ireland will set about tackling this threat to the wellness of our society in anything like the profound manner needed."" Adeleke's mother Adewumi Ademola paid tribute to her ""little girl"" in an interview with the Mail on Sunday. ""It’s too much for her. She’s just a little girl. I don’t know. It’s not good for her. It’s really awful,"" she told the Mail on Sunday. Ademola added that she was ""so low"" because her daughter has returned to Texas following the European Athletics Championships and is ""so far away"". ""I don’t want anything to happen to her. There’s no one with her. I just want to see that she’s OK.""",0,1
2024/6/17,"Almost 13,000 Irish birth information and tracing applications completed The Birth Information and Tracing Act has established a robust tracing service and a Contact Preference Register to support people affected by illegal birth registration. Almost 13,000 people have completed applications requesting information about their identity under the landmark Birth Information and Tracing Act. The Act, signed into law in June 2022, has established a robust tracing service and a Contact Preference Register to support people affected by illegal birth registration, including those who spent time in a Mother and Baby Home or Magdelene Laundries. Children's Minister Roderic O'Gorman published the figures on June 12 in the second Annual Report on the implementation of the Government’s Action Plan for Survivors and Former Residents of Mother and Baby and County Home Institutions. The report details that over 12,900 people have made applications for information about their identity since services commenced in October 2022. It further details the Government's ongoing efforts to establish a national memorial for the victims of Mother and Baby Homes, announced in July 2023. Sign up to IrishCentral's newsletter to stay up-to-date with everything Irish! The report notes that the Government is preparing an application for planning permission to establish the National Centre for Research and Remembrance on Sean McDermott Street. The Office of Public Works has also begun the first phase of works to make the remaining buildings at the site safe to access and to facilitate future works. Meanwhile, the report further noted that the Mother and Baby Institutions Payment Scheme opened to applicants in March 2024, with the first offers of awards issued in April. In May, the first payments were made and the first enhanced medical cards were issued. Patricia Carey was also appointed as Special Advocate for Survivors on March 25 following a lengthy recruitment process and will be responsible for amplifying the voices of survivors of Industrial and Reformatory Schools, Magdalen Laundries, Mother and Baby and County Home Institutions, as well as those who were adopted and boarded out. O'Gorman additionally established an independent office at the site of the former Mother and Baby Home in Tuam in May 2023 as part of the Industrial Burials Act 2022, which seeks to ensure that the remains of those who died at Mother and Baby Homes are given dignified burials. Speaking after the publication of the report, O'Gorman said the Government has worked tirelessly to deliver on commitments made to survivors. ""It is heartening to see the Birth Information and Tracing Act delivering long-awaited information for so many people, and I would like to thank Tusla and the Adoption Authority of Ireland for their efforts in this regard,"" O'Gorman said in a statement. ""Progress made on the site at Tuam, and the appointment of a Special Advocate for Survivors, demonstrate that the Government is delivering on its promises made to all those affected by Mother and Baby Institutions. ""I published the Action Plan for Survivors and Former Residents of Mother and Baby and County Home Institutions on behalf of Government in November 2021. Since then, we have worked intensively to deliver on the commitments made to survivors. ""I am pleased to be able to publish this second annual report detailing the meaningful progress we have achieved in that time.""",0,1
2024/6/17,"Taoiseach and US President discuss need for immediate ceasefire in Gaza Taoiseach Simon Harris and President Joe Biden had their first call since Harris became Taoiseach last month. Taoiseach Simon Harris spoke with US President Joe Biden on Monday evening, June 17. President Biden started by congratulating Simon Harris on becoming Taoiseach, the Department of the Taoiseach said on Monday. They spoke about power-sharing in Northern Ireland, the institutions of the Good Friday Agreement, and the ongoing work of the US Special Envoy to Northern Ireland for Economic Affairs, Joe Kennedy. They discussed the humanitarian catastrophe in Gaza, the need for an immediate ceasefire, for all hostages to be released, and for aid to flow freely. The Taoiseach briefed President Biden on the Ukraine Peace Summit held in Switzerland over the weekend and his conversation there with US Vice President Kamala Harris. President Biden told the Taoiseach that the United States would continue to support Ukraine and that the world must stand with Ukraine for as long as it takes. The Taoiseach and President Biden discussed the deep and growing economic ties between Ireland and the United States and Simon Harris also thanked the President for his enduring friendship to Ireland. He wished President Biden and the American people well. This evening I had a phone call with @POTUS. We discussed the need for an immediate ceasefire in the Middle East, the humanitarian crisis in Gaza, the recent summit on Ukraine, the reestablishment of the Northern Ireland institutions & our bilateral economic relationship. pic.twitter.com/VAVHT8qeuG Sign up to IrishCentral's newsletter to stay up-to-date with everything Irish! Monday evening was the first call between the two leaders since Harris became Taoiseach on April 9 following Leo Varadkar's surprise resignation in March. After Varadkar's resignation and before Harris officially became Taoiseach, Biden called Varadkar to wish him well in the wake of his resignation as Taoiseach and leader of Fine Gael. Varadkar, in turn, wished Biden good luck in November for the 2024 US Presidential election. Notably, Harris and Biden's call on Monday comes after Ireland, in concert with Spain and Norway, moved to formally recognize the State of Palestine. Including Ireland, Spain, and Norway, 145 out of the 193 UN member states have now recognized a Palestinian state. The US is not among them. While the Irish and American approaches to the war in Gaza have been starkly different, Harris did signal his support for Biden's announcement of a three-phased proposal to deliver a ceasefire in Gaza earlier this month. ""I have long called for an immediate ceasefire, the release of all hostages, and unimpeded access for aid into Gaza,"" Harris said in a statement on June 1. ""Now after almost eight months of conflict and suffering, there is a plan on the table that can move us closer to securing those goals and that can help create space to build a just and lasting peace and two-state solution. ""I call on all parties to give the plan presented by President Biden serious and positive consideration. ""This is an opportunity that should not be missed. ""It is long past time for the suffering to end.""",0,1
2024/6/18,"Eamon Ryan resigns as leader of Ireland’s Green Party after 13 years Eamon Ryan is the second leader of Ireland's current three-party coalition government to resign this year. Eamon Ryan announced today, Tuesday, June 18, that he is resigning as the leader of Ireland’s Green Party, one of the three parties making up Ireland's current coalition government. ""I'm here today to announce that I'm stepping down as the leader of The Green Party, Comhaontas Glas, and that I will not be standing in the next general election,"" Ryan said outside of Government Buildings in Dublin on Tuesday morning. ""I've spent the last 30 years either running for or holding public as a councillor, TD, and government minister. It's been an absolute privilege, and I want to thank the public who have voted for me on eight different occasions over those years, giving me the opportunity to serve our city and our country to the best of my ability. ""I'm stepping down to pass the torch to a new generation of leaders, confident in the strength and values I've seen built up in our party over all of these years. ""Our party will now elect a new leader to take the party forward from here and our own local group will now select a candidate to run in Dublin Bay South. ""I'll continue as party leader and in my ministerial roles until a new leader is appointed and look forward to fulfilling whatever role a new leader assigns me for the remaining terms of this government."" Ryan said he is ""confident"" the current government will run its full term. He continued: ""I will continue to work on climate action, but in a different way. ""I cannot continue to work the long hours that being a public representative involves which is why I'm not standing in the next general election. ""I have parenting commitments at home which I also want to serve. We have a son with special needs who also requires my attention. My wife, Victoria White, has been my greatest support and inspiration. I want to thank her, and all of my family and friends, who have been at my side at all times. ""I look forward to supporting our new party leader, to see out our current mandate, and then returning to the people looking at them for what direction we take next. ""I look forward to it all."" Sign up to IrishCentral's newsletter to stay up-to-date with everything Irish! As well as being leader of the Green Party, Ryan has been a Government leader and Minister for both the Department of the Environment, Climate and Communications and the Department of Transport since 2020. He is now the second coalition leader to step down this year following Leo Varadkar's resignation in March, which gave way to Simon Harris becoming leader of Fine Gael and now Taoiseach. Responding to Ryan’s resignation, Taoiseach Simon Harris said on Tuesday: “Minister Eamon Ryan yesterday informed me of his decision to resign his leadership of the Green Party. ""Eamon is a politician of enormous standing and I want to pay tribute to him and his family for everything they have given Irish politics through his leadership of the Greens. I respect and understand his decision. ""Eamon is a genuine, passionate and inherently decent person who brings those same qualities to politics. ""The leadership of the Green Party is now a matter for the party’s members and rules. ""The Government’s work continues and the Programme for Government between the three coalition parties will continue to be implemented. ""We have much work to do."" Meanwhile, Tanaiste Micheál Martin, the head of the third party in Ireland's current coalition government Fianna Fáil, wished Ryan the best. ""Eamon is a man of integrity & commitment. We have a good relationship, both personally & professionally,"" Martin said in a post on X. Wishing @EamonRyan the very best as he steps down as Green Party leader. Eamon is a man of integrity & commitment. We have a good relationship, both personally & professionally. He has always been consistent in his personal beliefs in terms of climate & biodiversity.",0,1
2024/6/18,"Irish Defence Forces donate 30 non-lethal military vehicles to Ukraine The Irish Defence Forces' Operation Carousel will facilitate the movement of 30 vehicles to the International Donor Coordination Cell in Rzeszów, Poland. Óglaigh na hÉireann, the Irish Defence Forces, has launched an operation to donate 30 non-lethal military vehicles to aid Ukraine in the ongoing war against Russia. The first of four convoys of Irish ambulances and recovery and transport vehicles arrived in Poland on Friday, June 14 ahead of their donation to Ukraine, Ireland's Department of Defence said on Friday. Led by the Defence Forces Transport Corps, Operation Carousel will facilitate the safe movement of 30 Defence Forces’ vehicles to the International Donor Coordination Cell in Rzeszów, Poland as part of Ireland’s European Peace Facility contribution. The operation of 54 personnel will see the vehicles moved over four convoys which will arrive in Poland over the next month. The donation is part of Ireland’s non-lethal aid to the Ukrainian Armed Forces following Russia’s full invasion of Ukraine in 2022. Speaking ahead of the convoy’s arrival, Tánaiste and Minister for Defence Micheál Martin said: “Ireland remains steadfast in support for the people of Ukraine following the illegal and immoral invasion by Russia and we will continue to provide what support we can as Ukraine defends itself against ongoing aggression. ""The donation of these ambulances and transport vehicles is a practical and concrete measure to show that support and is fully consistent with our position of providing non-lethal aid.” Operation Carousel, carried out by the Defence Forces Transport Corps, will facilitate the safe and secure movement of thirty ex- Defence Forces’ vehicles to the International Donor Coordination Cell in Rzeszów, Poland, as part of Ireland’s European Peace Facility contribution.… pic.twitter.com/xLJeVdLOTZ Sign up to IrishCentral's newsletter to stay up-to-date with everything Irish! The Department of Defence noted that the planned donation consists of 20 Ford Rangers, four Scania 8X8 DROPs, three Iveco 8X8 DROPs, an Iveco 8X8 Recovery Vehicle, and two Mercedes Sprinter Ambulances. The donation is the largest of Irish equipment since Russia launched the invasion of Ukraine in February 2022. According to The Irish Times, the Irish Defence Forces will not enter Ukraine as part of the operation. Most of the vehicles had already been earmarked for replacement with more modern versions as part of the Defence Forces' revitalization plan, according to the Irish Times. The plan will see a 50% increase in military spending by 2028.",0,1
2024/6/2,"Irish Government releases more than 2,000 files from Military Service Pensions Collection The Military Service Pensions Collection consists of applications for pensions by members of the Irish Volunteers, Citizen Army, Hibernian Rifles, Cumann na mBan, Fianna Éireann, IRA, and their dependents. The Irish Government has released more than 2,000 new files from the Military Service (1916-1923) Pensions Collection, providing new insight into the post-conflict lives of veterans who fought in the Irish War of Independence and Irish Civil War. The latest release of records, containing approximately 2,350 files, is the 16th release of the MSPC Project and the first release of 2024. The MSPC consists of applications for pensions by members of the Irish Volunteers, Citizen Army, Hibernian Rifles, Cumann na mBan, Fianna Éireann, IRA, and their dependents. The collection highlights the kind of lives that veterans lived following Ireland's struggle for independence, showcasing poverty, illness, mental illness, alcoholism, and precarious employment. The files relate to claims lodged by 967 individuals or their dependents and will allow members of the public to discover more about their ancestors in the lead-up to Irish independence, according to Tánaiste Micheál Martin. Sign up to IrishCentral's newsletter to stay up-to-date with everything Irish! ""I am very pleased to announce a further release of historical records contained in the Military Service (1916-1923) Pensions Collection,"" Martin said in a statement. ""These files offer valuable insights into the first-hand experience of those involved in the struggle for independence and allow members of the public the opportunity to discover more about their ancestors and their community during the period leading up to Irish independence."" Among the 967 individuals whose files have been released, 205 had an address in Cork, 181 in Dublin, and 89 in Northern Ireland. A further 49 individuals had an address in England, 51 in the USA, eight in Scotland, two in Canada, and two in Australia. A total of 742 individuals lodged applications under the Military Service Pensions Act of 1934, while 104 people lodged applications under the Military Service Pensions Act of 1924 (National Army Pensions). Additionally, a further 188 applications, including 14 applications by dependents (widows, mothers, and siblings), were lodged under the Army Pensions Acts (Special Allowances, wounds, disability, and dependents). Over 124,250 files have now been cataloged as part of the Military Service Pensions Collection, while over 84,000 have been digitized. The MSPC online database now contains 19,196 individual entries.",0,1
2024/6/2,"Taoiseach calls on Hamas/Israel to accept Biden ceasefire plan In a statement on Saturday afternoon, Harris called on Hamas and Israel to give ""serious and positive consideration"" to Biden's ceasefire deal. Taoiseach Simon Harris has described US President Joe Biden's plan for a ceasefire in Gaza as an ""opportunity not to be missed"". In a statement on Saturday afternoon, Harris called on Hamas and Israel to give ""serious and positive consideration"" to Biden's ceasefire deal. Biden said on Friday that Israel had offered a new roadmap to end the conflict in Gaza, stating that ""it's time for this war to end"". Sign up to IrishCentral's newsletter to stay up-to-date with everything Irish! The US President urged Hamas to accept the three-stage deal, which would begin with a six-week ceasefire during which Israeli Defence Forces (IDF) would withdraw from populated areas of Gaza. There would also be a ""surge"" of humanitarian aid during this first phase in addition to the exchange of some hostages for Palestinian prisoners. The deal would eventually lead to a permanent ""cessation of hostilities"" and a major reconstruction plan for Gaza. Hamas has said that it views the deal ""positively"". ""This is truly a decisive moment,"" Biden said on Friday. ""Hamas says it wants a ceasefire. This deal is an opportunity to prove whether they really mean it."" The Taoiseach also reiterated Ireland's call for an immediate ceasefire in Gaza, calling for all hostages to be released and for aid to be allowed to enter Gaza unimpeded. He said the deal ""can move us closer to securing"" a ceasefire and aid in addition to securing the release of hostages. He also said the deal can help ""create space to build a just and lasting peace and two-state solution"". ""I call on all parties to give the plan presented by President Biden serious and positive consideration,"" Harris said in a statement on Saturday. ""This is an opportunity that should not be missed. It is long past time for the suffering to end."" Earlier on Saturday, Tánaiste and Minister for Foreign Affairs Micheál Martin called for an immediate ceasefire in Gaza, stating that ""it's time to stop"". ""Now is the time for an immediate ceasefire in Gaza, the release of all hostages, and unhindered humanitarian aid to desperate Palestinian civilians,"" Martin said on Saturday. Meanwhile, Ophir Falk, chief foreign policy advisor to Israeli Prime Minister Benjamin Netanyahu said Biden's deal was ""not a good deal"" but that Israel would accept it. ""It's not a good deal but we dearly want the hostages released, all of them,"" Falk said. ""There are a lot of details to be worked out,"" he added. He said Israel's demands, including ""the release of the hostages and the destruction of Hamas as a genocidal terrorist organisation"", have not changed.",0,1
2024/6/2,"Love This Place campaign urges public to treat outdoors with care and respect The campaign urges the public to ""stick to the path"" to avoid trampling natural habitats and ""be a responsible dog owner"" by keeping their dogs on a leash and picking up their dog's waste. Leave No Trace Ireland, a program that promotes the responsible use of the outdoors in Ireland, has launched its Love This Place campaign, which urges the Irish public to enjoy the outdoors with care and respect. Launched on May 28 in collaboration with TV personality Roz Purcell and Minister of State for Nature Malcolm Noonan, the Love This Place campaign highlights three specific ""calls to action"". The campaign urges the public to ""stick to the path"" to avoid trampling natural habitats and ""be a responsible dog owner"" by keeping their dogs on a leash and picking up their dog's waste. It additionally calls on the public to ""keep Ireland litter free"", asking people to bring their litter home and dispose of it responsibly. Sign up to IrishCentral's newsletter to stay up-to-date with everything Irish! The campaign aims to promote a collective national effort to protect, respect, and care for Ireland's beautiful outdoor spaces. The Love This Place campaign will run throughout June, July, and August and features a National Love This Place Day on July 28, promoting a day of environmental action. Maura Kiely, Chief Executive of Leave No Trace Ireland, said the campaign aims to cultivate care and respect for outdoor spaces in Ireland. ""Research conducted by Leave No Trace Ireland confirms the need for targeted initiatives to raise awareness, particularly among younger people, around the importance of sustainable outdoor recreational practices,"" Kiely said in a statement. ""We need to equip individuals with knowledge and advice so that they can minimize their environmental impact while continuing to enjoy Ireland's beautiful landscapes, terrain, and habitats. ""We are asking everyone to take one or two simple actions that support responsible enjoyment of the outdoors and reinforce the environmental stewardship that all of us share."" Roz Purcell said she was ""honored"" to collaborate with Leave No Trace Ireland for the summer campaign. ""Together, we can ensure the longevity of our natural treasures by adopting mindful behaviors during our outdoor adventures. Let's make a collective promise to love and protect our cherished landscapes,"" Purcell said. Noonan, meanwhile, said the protection and restoration of nature and wildlife in Ireland is ""more important now than ever"". ""We are all responsible for looking after the natural world, but it’s only by working together that we can protect the countryside and ensure that when we’re out enjoying it, no trace is left behind,"" Noonan said.",0,1
